{
  "schema_version": "v0",
  "id": "cand-s01-revise_ai_suggestion-19c47d5b",
  "evidence_level": "candidate_inference",
  "node_type": "revise_ai_suggestion",
  "statement": "学生可能判断 AI 建议的默认类型推断不适合含千分位的数据，改为显式 dtype 方案。",
  "basis_event_ids": [
    "evt-s01-1",
    "evt-s01-2"
  ],
  "uncertainty": "中：AI 建议与代码提交是两条独立记录，系统不预设二者相关；是否参考及修改动机均需学生确认。",
  "question_to_student": "你是否因为默认类型推断无法处理千分位而修改了 AI 的建议？",
  "status": "resolved"
}
