{
  "schema_version": "v0",
  "id": "cand-s02-revise_ai_suggestion-3fc7492db4e96ea1",
  "evidence_level": "candidate_inference",
  "node_type": "revise_ai_suggestion",
  "statement": "学生可能调整了 AI 建议的输入校验方法，并采用了不同实现。",
  "basis_event_ids": [
    "evt-s02-1",
    "evt-s02-2"
  ],
  "uncertainty": "中：AI 建议与代码提交是两条独立记录，系统不预设二者相关；两种实现语义相近，是否参考需学生确认。",
  "question_to_student": "这次输入校验实现是否参考并调整了 AI 的建议？",
  "status": "resolved"
}
